{
  "schema": "publication-figure-design/reference-dna",
  "schema_version": "2.0",
  "identity": {
    "id": "55cb7dd1690cd0e8",
    "source": "independent visual-grammar reconstruction",
    "license": "generated independently; source license recorded in audit manifest",
    "journal": null,
    "year": null,
    "figure_family": "grouped_bar",
    "source_kind": "code"
  },
  "composition": {
    "aspect_ratio": null,
    "panel_count": 1,
    "panel_bboxes": [],
    "panel_area_ratios": [],
    "reading_order": [],
    "hero_panel": null,
    "gutters": {},
    "outer_margins": {},
    "alignment_lines": [],
    "whitespace_regions": {}
  },
  "palette": {
    "background": null,
    "dominant": [],
    "neutrals": [],
    "categorical": [],
    "sequential": [],
    "diverging": [],
    "accent": null,
    "semantic_roles": {},
    "area_share": {},
    "perceptual_distance": {},
    "cvd_score": null,
    "grayscale_score": null,
    "code_literals": [
      "A",
      "ABCD",
      "B",
      "C",
      "D",
      "E",
      "EFGH",
      "F",
      "G",
      "H",
      "density",
      "height",
      "high",
      "id",
      "kind",
      "mosaic",
      "scripts",
      "wide",
      "width"
    ]
  },
  "typography": {
    "family_class": "sans_serif_unknown",
    "title_body_ratio": null,
    "axis_tick_ratio": null,
    "panel_label_style": null,
    "weight": null,
    "line_height": null,
    "text_density": null,
    "alignment": null,
    "exact_font": null,
    "exactness": "code_declared"
  },
  "geometry": {
    "stroke_width_distribution": null,
    "marker_family": null,
    "marker_size_distribution": null,
    "corner_radius": null,
    "arrowhead": null,
    "leader_style": null,
    "spine_model": null,
    "grid_model": null,
    "plot_calls": [
      "Path",
      "exec_module",
      "insert",
      "module_from_spec",
      "render_from_spec",
      "resolve",
      "spec_from_file_location",
      "str",
      "with_name"
    ],
    "line_count": 19
  },
  "annotations": {
    "direct_labels": null,
    "brackets": null,
    "callouts": null,
    "leaders": null,
    "significance": null,
    "clearance": null
  },
  "hierarchy": {
    "focal_regions": null,
    "saliency_distribution": null,
    "visual_weight": null,
    "density": null,
    "data_to_ink_proxy": null
  },
  "style": {
    "aesthetic_tags": [
      "source-reconstruction",
      "figures4papers",
      "grouped_bar"
    ],
    "style_cluster": null,
    "style_vector": null,
    "quality_score": null
  },
  "constraints": {
    "must_match": [],
    "must_avoid": []
  },
  "embeddings": {
    "semantic_embedding": null,
    "visual_embedding": null,
    "structure_embedding": null
  },
  "confidence": {
    "geometry": 0.94,
    "palette": 0.86,
    "typography": 0.82
  },
  "extensions": {
    "visual_grammar": {},
    "figure_card": {},
    "code": {
      "calls": [
        "Path",
        "exec_module",
        "insert",
        "module_from_spec",
        "render_from_spec",
        "resolve",
        "spec_from_file_location",
        "str",
        "with_name"
      ],
      "static_only": true
    }
  }
}
