{
  "schema": "publication-figure-design/reference-dna",
  "schema_version": "2.0",
  "identity": {
    "id": "9991f9ad1973eac2",
    "source": "user-supplied reference image",
    "license": "user-supplied; redistribution not established",
    "journal": null,
    "year": null,
    "figure_family": "radial_arc_bar",
    "source_kind": "code"
  },
  "composition": {
    "aspect_ratio": null,
    "panel_count": 1,
    "panel_bboxes": [],
    "panel_area_ratios": [],
    "reading_order": [],
    "hero_panel": null,
    "gutters": {},
    "outer_margins": {},
    "alignment_lines": [],
    "whitespace_regions": {}
  },
  "palette": {
    "background": null,
    "dominant": [],
    "neutrals": [],
    "categorical": [],
    "sequential": [],
    "diverging": [],
    "accent": null,
    "semantic_roles": {
      "background": "white background with no tinted page panel",
      "contrast_and_emphasis": "dark text and outlines on light fills; emphasis uses saturated categorical marks",
      "roles_and_proportions": "pink outer arc, navy middle arc, salmon/lilac inner arcs; blue/peach/lilac bars"
    },
    "area_share": {},
    "perceptual_distance": {},
    "cvd_score": null,
    "grayscale_score": null,
    "code_literals": [
      "#252525",
      "#333333",
      "#334a8a",
      "#9b93bc",
      "#9cb5d2",
      "#aaa4c8",
      "#e6a18e",
      "#e8a0bd",
      "#f2c9bd",
      "RGB",
      "Saitama",
      "bold",
      "center",
      "off",
      "tight",
      "white"
    ]
  },
  "typography": {
    "family_class": "sans_serif_unknown",
    "title_body_ratio": null,
    "axis_tick_ratio": null,
    "panel_label_style": null,
    "weight": null,
    "line_height": null,
    "text_density": null,
    "alignment": null,
    "exact_font": null,
    "exactness": "code_declared"
  },
  "geometry": {
    "stroke_width_distribution": null,
    "marker_family": {
      "axes_and_scales": "axes/scales are explicit where quantitative coordinates are present; radial geometry declares its baseline",
      "guides_and_grid": "guides are sparse, low-contrast, and subordinate to marks",
      "marks_and_encoding": "thick semi-circular ring segments and aligned rectangular percentage bars"
    },
    "marker_size_distribution": null,
    "corner_radius": null,
    "arrowhead": null,
    "leader_style": null,
    "spine_model": null,
    "grid_model": null,
    "plot_calls": [
      "Path",
      "Rectangle",
      "Wedge",
      "add_patch",
      "axis",
      "close",
      "convert",
      "legend",
      "open",
      "render",
      "resize",
      "save",
      "savefig",
      "set_xlim",
      "set_ylim",
      "subplots",
      "text",
      "tight_layout",
      "with_name",
      "zip"
    ],
    "line_count": 37
  },
  "annotations": {
    "direct_labels": null,
    "brackets": null,
    "callouts": null,
    "leaders": null,
    "significance": null,
    "clearance": null
  },
  "hierarchy": {
    "focal_regions": null,
    "saliency_distribution": null,
    "visual_weight": null,
    "density": "low",
    "data_to_ink_proxy": null
  },
  "style": {
    "aesthetic_tags": [
      "radial-arc",
      "semi-circular",
      "percentage",
      "bar-comparison",
      "minimal"
    ],
    "style_cluster": null,
    "style_vector": null,
    "quality_score": 4.2
  },
  "constraints": {
    "must_match": [],
    "must_avoid": []
  },
  "embeddings": {
    "semantic_embedding": null,
    "visual_embedding": null,
    "structure_embedding": null
  },
  "confidence": {
    "geometry": 0.94,
    "palette": 0.86,
    "typography": 0.82
  },
  "extensions": {
    "visual_grammar": {
      "annotations_typography": {
        "callouts_and_leaders": "direct labels or compact equations stay adjacent to their marks; no decorative callouts",
        "placement_and_clearance": "labels remain outside dense marks or use explicit clearance; no light text on light fills",
        "text_hierarchy": "Saitama centered above the outer arc; percentages centered inside high-contrast segments"
      },
      "canvas_composition": {
        "alignment_and_spacing": "consistent gutters and clearance around labels; no overlaps at final size",
        "aspect_and_panel_layout": "single wide canvas with nested upper arcs, a three-part horizontal bar, and a bottom legend",
        "visual_hierarchy": "data marks dominate; labels and legend are secondary; whitespace is intentional"
      },
      "chart_marks_axes": {
        "axes_and_scales": "axes/scales are explicit where quantitative coordinates are present; radial geometry declares its baseline",
        "guides_and_grid": "guides are sparse, low-contrast, and subordinate to marks",
        "marks_and_encoding": "thick semi-circular ring segments and aligned rectangular percentage bars"
      },
      "connectors": "not_present",
      "legend_key": {
        "entries_and_encoding": "one entry per semantic color/mark role",
        "frame_treatment": "frameless or very light frame",
        "placement": "placed in the least dense whitespace region",
        "scope": "bottom-centered two-row legend grouped by Arc and Bar roles"
      },
      "must_match": [
        "nested arc radii",
        "arc-to-bar percentage correspondence",
        "large empty whitespace around marks"
      ],
      "objects_material": "not_present",
      "palette_roles": {
        "background": "white background with no tinted page panel",
        "contrast_and_emphasis": "dark text and outlines on light fills; emphasis uses saturated categorical marks",
        "roles_and_proportions": "pink outer arc, navy middle arc, salmon/lilac inner arcs; blue/peach/lilac bars"
      },
      "repetition_structures": {
        "count_spacing_rhythm": "repeatable rhythm is consistent across marks",
        "grouping_and_alignment": "groups align to their panel or baseline",
        "topology": "four arc roles nest concentrically; three bar roles repeat on one baseline",
        "variation_and_emphasis": "variation is carried by magnitude or position, not arbitrary decoration"
      }
    },
    "figure_card": {},
    "code": {
      "calls": [
        "Path",
        "Rectangle",
        "Wedge",
        "add_patch",
        "axis",
        "close",
        "convert",
        "legend",
        "open",
        "render",
        "resize",
        "save",
        "savefig",
        "set_xlim",
        "set_ylim",
        "subplots",
        "text",
        "tight_layout",
        "with_name",
        "zip"
      ],
      "static_only": true
    }
  }
}
