{
  "schema": "publication-figure-design/reference-dna",
  "schema_version": "2.0",
  "identity": {
    "id": "69782084ad8f59e4",
    "source": "user-supplied reference image",
    "license": "user-supplied; redistribution not established",
    "journal": null,
    "year": null,
    "figure_family": "ordination",
    "source_kind": "code"
  },
  "composition": {
    "aspect_ratio": null,
    "panel_count": 1,
    "panel_bboxes": [],
    "panel_area_ratios": [],
    "reading_order": [],
    "hero_panel": null,
    "gutters": {},
    "outer_margins": {},
    "alignment_lines": [],
    "whitespace_regions": {}
  },
  "palette": {
    "background": null,
    "dominant": [],
    "neutrals": [],
    "categorical": [],
    "sequential": [],
    "diverging": [],
    "accent": null,
    "semantic_roles": {
      "background": "white background with no tinted page panel",
      "contrast_and_emphasis": "dark text and outlines on light fills; emphasis uses saturated categorical marks",
      "roles_and_proportions": "coral Control and cyan T2D points with matching translucent confidence ellipses"
    },
    "area_share": {},
    "perceptual_distance": {},
    "cvd_score": null,
    "grayscale_score": null,
    "code_literals": [
      "#69bfd1",
      "#999999",
      "#eb8c7c",
      "AB",
      "Control",
      "RGB",
      "bold",
      "tight",
      "top",
      "white"
    ]
  },
  "typography": {
    "family_class": "sans_serif_unknown",
    "title_body_ratio": null,
    "axis_tick_ratio": null,
    "panel_label_style": null,
    "weight": null,
    "line_height": null,
    "text_density": null,
    "alignment": null,
    "exact_font": null,
    "exactness": "code_declared"
  },
  "geometry": {
    "stroke_width_distribution": null,
    "marker_family": {
      "axes_and_scales": "axes/scales are explicit where quantitative coordinates are present; radial geometry declares its baseline",
      "guides_and_grid": "guides are sparse, low-contrast, and subordinate to marks",
      "marks_and_encoding": "filled points inside group ellipses; dashed horizontal/vertical zero guides"
    },
    "marker_size_distribution": null,
    "corner_radius": null,
    "arrowhead": null,
    "leader_style": null,
    "spine_model": null,
    "grid_model": null,
    "plot_calls": [
      "Ellipse",
      "Path",
      "add_patch",
      "axhline",
      "axvline",
      "close",
      "convert",
      "default_rng",
      "enumerate",
      "legend",
      "mean",
      "multivariate_normal",
      "open",
      "render",
      "resize",
      "save",
      "savefig",
      "scatter",
      "set_linewidth",
      "set_title",
      "set_xlabel",
      "set_xlim",
      "set_ylabel",
      "set_ylim",
      "subplots",
      "text",
      "tick_params",
      "tight_layout",
      "values",
      "with_name"
    ],
    "line_count": 42
  },
  "annotations": {
    "direct_labels": null,
    "brackets": null,
    "callouts": null,
    "leaders": null,
    "significance": null,
    "clearance": null
  },
  "hierarchy": {
    "focal_regions": null,
    "saliency_distribution": null,
    "visual_weight": null,
    "density": "high",
    "data_to_ink_proxy": null
  },
  "style": {
    "aesthetic_tags": [
      "pcoa",
      "ordination",
      "two-panel",
      "group-ellipses",
      "permanova",
      "embedding"
    ],
    "style_cluster": null,
    "style_vector": null,
    "quality_score": 4.2
  },
  "constraints": {
    "must_match": [],
    "must_avoid": []
  },
  "embeddings": {
    "semantic_embedding": null,
    "visual_embedding": null,
    "structure_embedding": null
  },
  "confidence": {
    "geometry": 0.94,
    "palette": 0.86,
    "typography": 0.82
  },
  "extensions": {
    "visual_grammar": {
      "annotations_typography": {
        "callouts_and_leaders": "direct labels or compact equations stay adjacent to their marks; no decorative callouts",
        "placement_and_clearance": "labels remain outside dense marks or use explicit clearance; no light text on light fills",
        "text_hierarchy": "PERMANOVA, R2, and P annotations in the upper-left of each panel; titles centered above panels"
      },
      "canvas_composition": {
        "alignment_and_spacing": "consistent gutters and clearance around labels; no overlaps at final size",
        "aspect_and_panel_layout": "wide 1x2 panel layout with equal axes, shared visual grammar, and panel letters A/B",
        "visual_hierarchy": "data marks dominate; labels and legend are secondary; whitespace is intentional"
      },
      "chart_marks_axes": {
        "axes_and_scales": "axes/scales are explicit where quantitative coordinates are present; radial geometry declares its baseline",
        "guides_and_grid": "guides are sparse, low-contrast, and subordinate to marks",
        "marks_and_encoding": "filled points inside group ellipses; dashed horizontal/vertical zero guides"
      },
      "connectors": "not_present",
      "legend_key": {
        "entries_and_encoding": "one entry per semantic color/mark role",
        "frame_treatment": "frameless or very light frame",
        "placement": "placed in the least dense whitespace region",
        "scope": "compact lower-left two-entry legend in the first panel only"
      },
      "must_match": [
        "equal panel widths",
        "group color and ellipse pairing",
        "zero-axis guides",
        "panel letters"
      ],
      "objects_material": "not_present",
      "palette_roles": {
        "background": "white background with no tinted page panel",
        "contrast_and_emphasis": "dark text and outlines on light fills; emphasis uses saturated categorical marks",
        "roles_and_proportions": "coral Control and cyan T2D points with matching translucent confidence ellipses"
      },
      "repetition_structures": {
        "count_spacing_rhythm": "repeatable rhythm is consistent across marks",
        "grouping_and_alignment": "groups align to their panel or baseline",
        "topology": "two ordination panels repeat the same Control/T2D mark system while changing distance metric",
        "variation_and_emphasis": "variation is carried by magnitude or position, not arbitrary decoration"
      }
    },
    "figure_card": {},
    "code": {
      "calls": [
        "Ellipse",
        "Path",
        "add_patch",
        "axhline",
        "axvline",
        "close",
        "convert",
        "default_rng",
        "enumerate",
        "legend",
        "mean",
        "multivariate_normal",
        "open",
        "render",
        "resize",
        "save",
        "savefig",
        "scatter",
        "set_linewidth",
        "set_title",
        "set_xlabel",
        "set_xlim",
        "set_ylabel",
        "set_ylim",
        "subplots",
        "text",
        "tick_params",
        "tight_layout",
        "values",
        "with_name"
      ],
      "static_only": true
    }
  }
}
